Movie,Genre,Runtime,Imdb_Rating,Metascore_Rating,Release_date,Popularity,Votes,Director,Stars,Description
The Bachelors,"Comedy, Drama",99 min,6.8,54,2017-10-20,7.816,2511,Kurt Voelker,"Odeya Rush,J.K. Simmons,Kitana Turnbull,Harold Perrineau","After the early death of his wife, a mourning father moves with his teenage son across the country for a private school teaching job. Their lives begin to transform due to two unique women, who help them embrace life and love again."
Bushwick,"Action, Adventure",94 min,5.2,44,2017-07-30,8.056,7042,"Jonathan Milott,Cary Murnion","Dave Bautista,Brittany Snow,Angelic Zambrana,Jeremie Harris","When a Texas military force invades their Brooklyn neighborhood, 20-year-old Lucy and war veteran Stupe must depend on each other to survive."
Batman and Harley Quinn,"Animation, Action, Adventure",74 min,5.9,0,2017-08-14,9.105,8600,Sam Liu,"Kevin Conroy,Melissa Rauch,Paget Brewster,Loren Lester","Batman and Nightwing are forced to team with the Joker's sometimes-girlfriend Harley Quinn to stop a global threat brought about by Poison Ivy and Jason Woodrue, the Floronic Man."
9/11,"Action, Drama",90 min,4.1,20,2017-09-07,7.697,2451,Martin Guigui,"Charlie Sheen,Gina Gershon,Whoopi Goldberg,Luis Guzmán","A group of five people find themselves trapped in an elevator in the World Trade Center's North Tower on 9/11. They work together, never giving up hope, to try to escape before the unthinkable happens."
The Dinner,"Crime, Drama, Thriller",120 min,4.5,57,2017-05-05,6.962,6242,Oren Moverman,"Michael Chernus,Taylor Rae Almonte,Steve Coogan,Charlie Plummer",Two sets of wealthy parents meet for dinner to decide what to do about a crime their sons have committed.
Arsenal,"Action, Crime, Drama",97 min,4.0,25,2017-01-06,7.117,3321,Steven C. Miller,"Nicolas Cage,John Cusack,Adrian Grenier,Johnathon Schaech",A Southern mobster attempts to rescue his kidnapped brother.
Tragedy Girls,"Comedy, Crime, Horror",98 min,6.0,58,2017-10-20,7.702,6428,Tyler MacIntyre,"Brianna Hildebrand,Alexandra Shipp,Jack Quaid,Kevin Durand","A twist on the slasher genre, following two death-obsessed teenage girls who use their online show about real-life tragedies to send their small mid-western town into a frenzy, and cement their legacy as modern horror legends."
Kodachrome,Drama,105 min,6.8,57,2017-09-08,9.356,7733,Mark Raso,"Ed Harris,Jason Sudeikis,Elizabeth Olsen,Bruce Greenwood","Set during the final days of the admired photo development system known as Kodachrome, a father and son hit the road in order to reach the Kansas photo lab before it closes its doors for good."
A Christmas Prince,"Comedy, Romance",92 min,5.7,0,2017-11-17,8.824,11504,Alex Zamm,"Rose McIver,Ben Lamb,Alice Krige,Honor Kneafsey","When a reporter goes undercover as a tutor to get the inside scoop on a playboy prince, she gets tangled in some royal intrigue and ends up finding love - but will she be able to keep up her lie?"
Muse,"Horror, Sci-Fi, Thriller",107 min,5.4,0,2017-11-29,8.341,2346,Jaume Balagueró,"Elliot Cowan,Franka Potente,Ana Ularu,Leonor Watling",A grieving English literature professor who is suffering from a horrible recurring nightmare will soon find himself immersed in a macabre world of myth and superstition governed by a coven of seven malevolent women.
Woody Woodpecker,"Animation, Comedy, Family",91 min,4.2,0,2017-10-05,7.984,2414,Alex Zamm,"Eric Bauza,Timothy Omundson,Graham Verchere,Jordana Largy",The hyperactive red-headed bird enters a turf war with a big city lawyer wanting to tear down his home in an effort to build a house to flip.
The Case for Christ,"Biography, Drama",112 min,6.2,50,2017-04-07,7.242,6102,Jon Gunn,"Erika Christensen,Faye Dunaway,Frankie Faison,Robert Forster",An investigative journalist and self-proclaimed atheist sets out to disprove the existence of God after his wife becomes a Christian.
Beatriz at Dinner,"Comedy, Drama",82 min,6.1,68,2017-06-09,7.539,7685,Miguel Arteta,"Salma Hayek,John Lithgow,Connie Britton,Jay Duplass",A holistic medicine practitioner attends a wealthy client's dinner party after her car breaks down.
Wheelman,"Action, Crime, Mystery",82 min,6.4,66,2017-10-20,7.435,13320,Jeremy Rush,"Frank Grillo,Caitlin Carmichael,Garret Dillahunt,Shea Whigham",A getaway driver for a bank robbery realizes he has been double crossed and races to find out who betrayed him.
S.M.A.R.T. Chase,"Action, Adventure, Crime",95 min,4.2,0,2017-09-30,7.692,1246,Charles Martin,"Orlando Bloom,Lei Wu,Simon Yam,Hannah Quinlivan",A washed-up private security agent has to escort a valuable Chinese antique out of Shanghai but is ambushed en route.
Viceroy's House,"Biography, Drama, History",106 min,6.7,53,2017-03-03,8.065,5156,Gurinder Chadha,"Hugh Bonneville,Gillian Anderson,Manish Dayal,Huma Qureshi","The final Viceroy of India, Lord Mountbatten, is tasked with overseeing the transition of British India to independence, but meets with conflict as different sides clash in the face of monumental change."
The Recall,"Action, Sci-Fi, Thriller",90 min,4.4,0,2017-06-02,8.51,5937,Mauro Borrelli,"Wesley Snipes,RJ Mitte,Jedidiah Goodacre,Laura Bilgeri","When five friends vacation at a remote lake house they expect nothing less than a good time, unaware that planet Earth is under an alien invasion and mass-abduction."
The Polka King,"Biography, Comedy, Drama",95 min,5.9,65,2017-01-22,9.254,6664,Maya Forbes,"Jack Black,Jenny Slate,Jason Schwartzman,Jacki Weaver",Local Pennsylvania polka legend Jan Lewan develops a plan to get rich that shocks his fans and lands him in jail.
The Outcasts,Comedy,95 min,5.5,47,2017-04-14,7.487,2863,Peter Hutchings,"Victoria Justice,Eden Sher,Ashley Rickards,Avan Jogia","After falling victim to a humiliating prank by the high school Queen Bee, best friends and world-class geeks, Mindy and Jodi, decide to get their revenge by uniting the outcasts of the school against her and her circle of friends."
Keep Watching,"Horror, Thriller",89 min,4.4,0,2017-05-04,8.257,3187,Sean Carter,"Bella Thorne,Chandler Riggs,Ioan Gruffudd,Natalie Martinez","A family become imprisoned in their home by intruders, who force them to play a life-and-death game, where the mysterious rules become clear as the night unfolds."
Baahubali 2: The Conclusion,"Action, Drama, Fantasy",167 min,8.3,0,2017-04-27,9.237,63300,S.S. Rajamouli,"Prabhas,Rana Daggubati,Anushka Shetty,Tamannaah Bhatia","When Shiva, the son of Bahubali, learns about his heritage, he begins to look for answers. His story is juxtaposed with past events that unfolded in the Mahishmati Kingdom."
Revolt,"Action, Sci-Fi, War",87 min,5.2,0,2017-07-01,9.311,6325,Joe Miale,"Lee Pace,Bérénice Marlohe,Jason Flemyng,Sibulele Gcilitshana","An amnesiac US soldier's in a cell next to a cute, French doctor. Earth is under attack by big, alien robots. Kenyan soldiers come to rape, torture and kill but the 2 fight back. They find a car and head west."
The Crucifixion,"Horror, Mystery, Thriller",90 min,5.0,0,2017-04-27,8.214,4864,Xavier Gens,"Sophie Cookson,Corneliu Ulici,Ada Lupu,Brittany Ashworth",When Nicole comes in contact with Father Anton (Corneliu Ulici) more and more inexplicable events occur. The pair begin to believe that the priest lost the battle with a demon.
